name,location,link_url
Barnacle Goose,"4933 Rome-New London Rd, Rome US-NY 43.21695, -75.56275, Oneida, New York, United States",/species/bargoo/US-NY
Barnacle Goose,"4933 Rome-New London Rd, Rome US-NY 43.21715, -75.56228, Oneida, New York, United States",/species/bargoo/US-NY
Barnacle Goose,"4948 Rome-New London Road, Rome, New York, US (43.217, -75.561), Oneida, New York, United States",/species/bargoo/US-NY
Cackling Goose,"Braddock Bay Park--Hawk Watch, Monroe, New York, United States",/species/cacgoo1/US-NY
Cackling Goose,"Hogan Point Rd., pond and flooded field, Monroe, New York, United States",/species/cacgoo1/US-NY
Mute Swan,"350 Lake Rd, Dryden US-NY 42.46616, -76.27340, Tompkins, New York, United States",/species/mutswa/US-NY
Mute Swan,"Iroquois NWR--Kanyoo Trail, Genesee, New York, United States",/species/mutswa/US-NY
Mute Swan,"Iroquois NWR--Kumpf Marsh, Genesee, New York, United States",/species/mutswa/US-NY
Mute Swan,"Roosevelt Island--FDR Four Freedoms and Parks S of Cornell Tech, New York, New York, United States",/species/mutswa/US-NY
Trumpeter Swan,"416 Manitou Road, Hilton, New York, US (43.306, -77.749), Monroe, New York, United States",/species/truswa/US-NY
Trumpeter Swan,"Cline Rd., marsh (east), Fulton, New York, United States",/species/truswa/US-NY
Trumpeter Swan,"Lake Alice WMA, Clinton, New York, United States",/species/truswa/US-NY
Trumpeter Swan,"Lake Alice WMA, Clinton, New York, United States",/species/truswa/US-NY
Gadwall,"Houghton - Field of Dreams, Allegany, New York, United States",/species/gadwal/US-NY
Eurasian Wigeon,"Conesus Inlet WMA--East Swamp Rd. (midway pond), Livingston, New York, United States",/species/eurwig/US-NY
Eurasian Wigeon,"Wilson Hill WMA--Causeway, St. Lawrence, New York, United States",/species/eurwig/US-NY
American Wigeon x Mallard (hybrid),"Belmont State Park, Suffolk, New York, United States",/species/x00611/US-NY
American Black Duck,"Sherburne 4 Corners ag fields & pond, Chenango, New York, United States",/species/ambduc/US-NY
Canvasback,"Long Pond SF--Rt. 41 fishing access, Chenango, New York, United States",/species/canvas/US-NY
Canvasback,"Long Pond SF--Rt. 41 fishing access, Chenango, New York, United States",/species/canvas/US-NY
Canvasback,"Times Beach Nature Preserve, Erie, New York, United States",/species/canvas/US-NY
Redhead,"Highland Park (Queens Co.), Queens, New York, United States",/species/redhea/US-NY
Redhead,"Highland Park (Queens Co.), Queens, New York, United States",/species/redhea/US-NY
Redhead,"Ridgewood Reservoir, Queens, New York, United States",/species/redhea/US-NY
Redhead,"Ridgewood Reservoir, Queens, New York, United States",/species/redhea/US-NY
Ring-necked Duck,"Irvington Woods, Westchester, New York, United States",/species/rinduc/US-NY
Ring-necked Duck,"New Croton Reservoir, Westchester, New York, United States",/species/rinduc/US-NY
Tufted Duck,"Great Pond, Suffolk, New York, United States",/species/tufduc/US-NY
Tufted Duck,"Great Pond, Suffolk, New York, United States",/species/tufduc/US-NY
Tufted Duck,"Great Pond, Suffolk, New York, United States",/species/tufduc/US-NY
Tufted Duck,"Great Pond, Suffolk, New York, United States",/species/tufduc/US-NY
Greater Scaup,"Upper Lisle County Park, Broome, New York, United States",/species/gresca/US-NY
Greater Scaup,"Upper Lisle County Park, Broome, New York, United States",/species/gresca/US-NY
Lesser Scaup,"Keuka Lake, Champlin Beach, Steuben, New York, United States",/species/lessca/US-NY
Lesser Scaup,"Young’s Lake - Richfield Springs 42.84169, -74.91807, Herkimer, New York, United States",/species/lessca/US-NY
Surf Scoter,"Onondaga Lake Park--West Shore Trail, Lakeview Point, Onondaga, New York, United States",/species/sursco/US-NY
Surf Scoter,"Onondaga Lake Park--West Shore Trail, Lakeview Point, Onondaga, New York, United States",/species/sursco/US-NY
Surf Scoter,"Onondaga Lake Park--West Shore Trail, Visitor's Center to Lakeview Point, Onondaga, New York, United States",/species/sursco/US-NY
Black Scoter,"Coney Island And Brighton Beach, Kings, New York, United States",/species/blksco2/US-NY
Black Scoter,"Coney Island Creek Park, Kings, New York, United States",/species/blksco2/US-NY
Long-tailed Duck,"Coney Island And Brighton Beach, Kings, New York, United States",/species/lotduc/US-NY
Long-tailed Duck,"Tobay Beach Park, Nassau, New York, United States",/species/lotduc/US-NY
Long-tailed Duck,"Wildlife Dr, Seneca Falls US-NY 42.97403, -76.73805, Seneca, New York, United States",/species/lotduc/US-NY
Common Goldeneye,"2159 Lakeshore Dr, Blossvale US-NY 43.22335, -75.74345, Oneida, New York, United States",/species/comgol/US-NY
Common Goldeneye,"2159 Lakeshore Dr, Blossvale US-NY 43.22335, -75.74345, Oneida, New York, United States",/species/comgol/US-NY
Common Goldeneye,"Oneida Lake--Lakeshore, Oneida, New York, United States",/species/comgol/US-NY
Barrow's Goldeneye,"Brown Rd., Wolcott, Wayne, New York, United States",/species/bargol/US-NY
Hooded Merganser,"Central Park, New York, New York, United States",/species/hoomer/US-NY
Hooded Merganser,"Prospect Park, Kings, New York, United States",/species/hoomer/US-NY
Hooded Merganser,"Prospect Park--Prospect Lake, Kings, New York, United States",/species/hoomer/US-NY
Hooded Merganser,"Tibbetts Brook Park, Westchester, New York, United States",/species/hoomer/US-NY
Common Merganser,"16 Salt Marsh Path, Suffolk, New York, United States",/species/commer/US-NY
Common Merganser,"Central Park, New York, New York, United States",/species/commer/US-NY
Common Merganser,"Wertheim NWR, Suffolk, New York, United States",/species/commer/US-NY
Common Merganser,"Wertheim National Wildlife Refuge, Shirley US-NY 40.79408, -72.88097, Suffolk, New York, United States",/species/commer/US-NY
Red-breasted Merganser,"Tubbs Hill Rd, Richford, Tioga, New York, United States",/species/rebmer/US-NY
Red-breasted Merganser,"Wildlife Dr, Seneca Falls US-NY 42.96917, -76.73878, Seneca, New York, United States",/species/rebmer/US-NY
Wild Turkey,"The Battery, Manhattan, New York, New York, United States",/species/wiltur/US-NY
Wild Turkey,"The Battery, Manhattan, New York, New York, United States",/species/wiltur/US-NY
Wild Turkey,"The Battery, Manhattan, New York, New York, United States",/species/wiltur/US-NY
Wild Turkey,"The Battery, Manhattan, New York, New York, United States",/species/wiltur/US-NY
Ruffed Grouse,"Barrytown Road, Dutchess, New York, United States",/species/rufgro/US-NY
Ring-necked Pheasant,"Sky High Farm (Ancram), Columbia, New York, United States",/species/rinphe1/US-NY
Rock Pigeon,"30 Titus Rd, Poughkeepsie US-NY 41.71443, -73.84663, Dutchess, New York, United States",/species/rocpig/US-NY
Rock Pigeon,"Central Park--SW from 65th St. transv.-Center Dr., New York, New York, United States",/species/rocpig/US-NY
Black-billed Cuckoo-Dove,"Sterling Forest SP--Ironwood Drive (right-of-way), Orange, New York, United States",/species/bbcdov1/US-NY
Yellow-billed Cuckoo,"Bear Mountain SP--Jones Point Path, Rockland, New York, United States",/species/yebcuc/US-NY
Yellow-billed Cuckoo,"Great Vly WMA--West Camp Rd., Ulster, New York, United States",/species/yebcuc/US-NY
Yellow-billed Cuckoo,"Stewart SF, Orange, New York, United States",/species/yebcuc/US-NY
Black-billed Cuckoo,"Bashakill State WMA, Sullivan, New York, United States",/species/bkbcuc/US-NY
Black-billed Cuckoo,"Central Park, New York, New York, United States",/species/bkbcuc/US-NY
Black-billed Cuckoo,"Deep Hollow Rd. (Dutchess Co.), Dutchess, New York, United States",/species/bkbcuc/US-NY
Eastern Whip-poor-will,"Home, Essex, New York, United States",/species/easwpw1/US-NY
Eastern Whip-poor-will,"Home, Essex, New York, United States",/species/easwpw1/US-NY
Eastern Whip-poor-will,"Ontario Home Patch, Wayne, New York, United States",/species/easwpw1/US-NY
Eastern Whip-poor-will,"Roosevelt Road Sand Pits, Oswego, New York, United States",/species/easwpw1/US-NY
Chimney Swift,"Bath, NY, Steuben, New York, United States",/species/chiswi/US-NY
Chimney Swift,"Bath, NY, Steuben, New York, United States",/species/chiswi/US-NY
Chimney Swift,"Bath, NY, Steuben, New York, United States",/species/chiswi/US-NY
Ruby-throated Hummingbird,"173 Avon Rd, Rochester US-NY 43.14134, -77.52862, Monroe, New York, United States",/species/rthhum/US-NY
Ruby-throated Hummingbird,"Archer acres (43.168, -78.064), Orleans, New York, United States",/species/rthhum/US-NY
Ruby-throated Hummingbird,"Besemer Hill Rd, Ithaca US-NY, Tompkins, New York, United States",/species/rthhum/US-NY
Ruby-throated Hummingbird,"Sam Adams Road, Clayton, NY, Jefferson, New York, United States",/species/rthhum/US-NY
Clapper Rail,"Pelham Bay Park--Turtle Cove, Bronx, New York, United States",/species/clarai11/US-NY
Clapper Rail,"Pelham Bay Park--Turtle Cove, Bronx, New York, United States",/species/clarai11/US-NY
Clapper Rail,"Pelham Bay Park--Turtle Cove, Bronx, New York, United States",/species/clarai11/US-NY
Virginia Rail,"Fireplace Neck Tidal Wetlands, Suffolk, New York, United States",/species/virrai/US-NY
Virginia Rail,"Heckscher SP--Field 5, Suffolk, New York, United States",/species/virrai/US-NY
Virginia Rail,"Little Reed Pond, Montauk, Suffolk, New York, United States",/species/virrai/US-NY
Sora,"Ely Rd. wetlands, Cortland, New York, United States",/species/sora/US-NY
Sora,"Sherburne 4 Corners ag fields & pond, Chenango, New York, United States",/species/sora/US-NY
Sora,"Sherburne 4 Corners ag fields & pond, Chenango, New York, United States",/species/sora/US-NY
Common Gallinule,"Ausable Marsh WMA, Clinton, New York, United States",/species/comgal1/US-NY
Common Gallinule,"Ausable Marsh WMA, Clinton, New York, United States",/species/comgal1/US-NY
Common Gallinule,"Sherburne 4 Corners ag fields & pond, Chenango, New York, United States",/species/comgal1/US-NY
Common Gallinule,"Weaver Lake, Warren, Herkimer, New York, United States",/species/comgal1/US-NY
Sandhill Crane,"Cline Rd., marsh (east), Fulton, New York, United States",/species/sancra/US-NY
Sandhill Crane,"Cline Rd., marsh (east), Fulton, New York, United States",/species/sancra/US-NY
Sandhill Crane (Greater),"McCall Pond - Tamarac Rd & CR18, Chenango, New York, United States",/species/sancra/US-NY
Sandhill Crane (Greater),"McCall Pond - Tamarac Rd & CR18, Chenango, New York, United States",/species/sancra/US-NY
Sandhill Crane (Greater),"Sherburne 4 Corners ag fields & pond, Chenango, New York, United States",/species/sancra/US-NY
Sandhill Crane (Greater),"Sherburne 4 Corners ag fields & pond, Chenango, New York, United States",/species/sancra/US-NY
Sandhill Crane,"Sherburne railroad grade marsh, Chenango, New York, United States",/species/sancra/US-NY
Sandhill Crane,"Tupper Lake Overlook--North, Franklin, New York, United States",/species/sancra/US-NY
Black-necked Stilt,"47 Cove Hollow Farm Rd, East Hampton US-NY (40.9396,-72.2204), Suffolk, New York, United States",/species/bknsti/US-NY
Black-necked Stilt,"Georgica Cove Hollow, Suffolk, New York, United States",/species/bknsti/US-NY
Black-necked Stilt (Black-necked),"Georgica Cove Hollow, Suffolk, New York, United States",/species/bknsti/US-NY
Black-necked Stilt,"Georgica Cove, East Hampton, New York, US, Suffolk, New York, United States",/species/bknsti/US-NY
Black-necked Stilt,"Peconic Land Trust property, East Hampton US-NY 40.93921, -72.22158, Suffolk, New York, United States",/species/bknsti/US-NY
Semipalmated Plover,"Jamaica Bay Wildlife Refuge--West Pond, Queens, New York, United States",/species/semplo/US-NY
Semipalmated Plover,"Sunset Cove Park, Queens, New York, United States",/species/semplo/US-NY
Semipalmated Plover,"Sunset Cove Park, Queens, New York, United States",/species/semplo/US-NY
Semipalmated Plover,"Sunset Cove Park, Queens, New York, United States",/species/semplo/US-NY
Piping Plover,"Lakeview WMA, Jefferson, New York, United States",/species/pipplo/US-NY
Upland Sandpiper,"Poland West, Oneida, New York, United States",/species/uplsan/US-NY
Short-billed Dowitcher,"Captree Island, Suffolk, New York, United States",/species/shbdow/US-NY
Short-billed Dowitcher,"Ponquogue Bridge, Suffolk, New York, United States",/species/shbdow/US-NY
Long-billed Dowitcher,"Iroquois NWR--Feeder Rd. Trail (Genesee Co.), Genesee, New York, United States",/species/lobdow/US-NY
Long-billed Dowitcher,"Iroquois NWR--Kumpf Marsh, Genesee, New York, United States",/species/lobdow/US-NY
Long-billed Dowitcher,"Iroquois NWR--Kumpf Marsh, Genesee, New York, United States",/species/lobdow/US-NY
Long-billed Dowitcher,"Ridge Chapel Road Between Ridge Road and Beach Road, Wayne, New York, United States",/species/lobdow/US-NY
Wilson's Snipe,"Governors Island (N.Y. County), New York, New York, United States",/species/wilsni1/US-NY
Wilson's Snipe,"Governors Island (N.Y. County), New York, New York, United States",/species/wilsni1/US-NY
Wilson's Snipe,"Randalls Island, New York, New York, United States",/species/wilsni1/US-NY
Wilson's Snipe,"Randalls Island, New York, New York, United States",/species/wilsni1/US-NY
Solitary Sandpiper,"Genesee St. (NY 63), flooded field & marsh, Piffard, Livingston, New York, United States",/species/solsan/US-NY
Solitary Sandpiper,"Genesee Valley Greenway, Chandler Road, Livingston, New York, United States",/species/solsan/US-NY
Lesser Yellowlegs,"Inwood Hill Park, New York, New York, United States",/species/lesyel/US-NY
Lesser Yellowlegs,"Inwood Hill Park, New York, New York, United States",/species/lesyel/US-NY
Lesser Yellowlegs,"Pelham Bay Park--Turtle Cove, Bronx, New York, United States",/species/lesyel/US-NY
Lesser Yellowlegs,"Pelham Bay Park--Turtle Cove, Bronx, New York, United States",/species/lesyel/US-NY
Willet (Eastern),"Governors Island (N.Y. County), New York, New York, United States",/species/willet1/US-NY
Willet (Western),"Myers Point, Tompkins, New York, United States",/species/willet1/US-NY
Willet,"Myers Point, Tompkins, New York, United States",/species/willet1/US-NY
Willet,"Myers Point, Tompkins, New York, United States",/species/willet1/US-NY
Willet,"Myers Point, Tompkins, New York, United States",/species/willet1/US-NY
Willet (Western),"Myers Point, Tompkins, New York, United States",/species/willet1/US-NY
Willet (Western),"Myers Point, Tompkins, New York, United States",/species/willet1/US-NY
Willet (Western),"Salt Point Natural Area, Tompkins, New York, United States",/species/willet1/US-NY
Willet,"Salt Point Natural Area, Tompkins, New York, United States",/species/willet1/US-NY
Greater Yellowlegs,"Governors Island (N.Y. County), New York, New York, United States",/species/greyel/US-NY
Greater Yellowlegs,"Morningside Park, Manhattan, New York, New York, United States",/species/greyel/US-NY
Greater Yellowlegs,"Trinity Church, Wall St., New York, New York, United States",/species/greyel/US-NY
Purple Sandpiper,"Pelham Bay Park--Orchard Beach & parking lot, Bronx, New York, United States",/species/pursan/US-NY
Least Sandpiper,"Montezuma (NMWMA)--Carncross Rd., Wayne, New York, United States",/species/leasan/US-NY
Least Sandpiper,"Myers Point, Tompkins, New York, United States",/species/leasan/US-NY
Least Sandpiper,"Plumb Beach, Kings, New York, United States",/species/leasan/US-NY
Least Sandpiper,"Salt Point Natural Area, Tompkins, New York, United States",/species/leasan/US-NY
Pectoral Sandpiper,"Dead Creek, Pardy Road, Clinton, New York, United States",/species/pecsan/US-NY
Semipalmated Sandpiper,"Dune Rd.  Suffolk, NY, Suffolk, New York, United States",/species/semsan/US-NY
Semipalmated Sandpiper,"Montezuma NWR (general area), , New York, United States",/species/semsan/US-NY
Parasitic Jaeger,"Dawn Chorus Farm (private), Seneca, New York, United States",/species/parjae/US-NY
Little Gull,"Amboy Rd. X Wards Point Ave. Waterfront, Richmond, New York, United States",/species/litgul/US-NY
Little Gull,"Amboy Rd. X Wards Point Ave. Waterfront, Richmond, New York, United States",/species/litgul/US-NY
Little Gull,"Conference House Park, Richmond, New York, United States",/species/litgul/US-NY
Little Gull,"Seneca Lake, Dresden, Yates, New York, United States",/species/litgul/US-NY
Bonaparte's Gull,"Cortland Gravel Pits, Cortland, New York, United States",/species/bongul/US-NY
Bonaparte's Gull,"Upper New York Bay, Manhattan, New York, New York, United States",/species/bongul/US-NY
Black-headed Gull,"Newtown Creek Nature Walk, Kings, New York, United States",/species/bkhgul/US-NY
Glaucous Gull,"Fort Tilden--Fishermans Parking Lot, Queens, New York, United States",/species/glagul/US-NY
Lesser Black-backed Gull,"Fort Tilden, Queens, New York, United States",/species/lbbgul/US-NY
Lesser Black-backed Gull,"Point Peninsula--South Shore Road, Jefferson, New York, United States",/species/lbbgul/US-NY
Lesser Black-backed Gull,"Sandy Pond Outlet, Oswego, New York, United States",/species/lbbgul/US-NY
Lesser Black-backed Gull,"Sandy Pond Outlet, Oswego, New York, United States",/species/lbbgul/US-NY
Iceland Gull (kumlieni),"Derby Hill Hawk Watch--North Lookout, Oswego, New York, United States",/species/y00478/US-NY
Iceland Gull (kumlieni),"Derby Hill Hawk Watch--North Lookout, Oswego, New York, United States",/species/y00478/US-NY
Black Skimmer,"Nickerson Beach, Nassau, New York, United States",/species/blkski/US-NY
Least Tern,"Maple Ave. Dock, Suffolk, New York, United States",/species/leater1/US-NY
Least Tern,"Seganus Thatch--North, Suffolk, New York, United States",/species/leater1/US-NY
Least Tern,"Shinnecock County Park West, Suffolk, New York, United States",/species/leater1/US-NY
Least Tern,"South Ferry Slip, Sag Harbor, Suffolk, New York, United States",/species/leater1/US-NY
Gull-billed Tern,"Nickerson Beach, Nassau, New York, United States",/species/gubter2/US-NY
Caspian Tern,"Georgica Beach, East Hampton, Suffolk, New York, United States",/species/caster1/US-NY
Caspian Tern,"Silver Lake (Wyoming Co.), south, Wyoming, New York, United States",/species/caster1/US-NY
Caspian Tern,"Wertheim NWR--Headquarters Building, Suffolk, New York, United States",/species/caster1/US-NY
Black Tern,"Bemus Point Spit, Chautauqua, New York, United States",/species/blkter/US-NY
Black Tern,"Myers Point, Tompkins, New York, United States",/species/blkter/US-NY
Black Tern,"Myers Point, Tompkins, New York, United States",/species/blkter/US-NY
Black Tern,"Myers Point, Tompkins, New York, United States",/species/blkter/US-NY
Forster's Tern,"5873 New York 26, Whitney Point, New York, US (42.38, -75.965), Broome, New York, United States",/species/forter/US-NY
Forster's Tern,"Dunkirk Harbor, Chautauqua, New York, United States",/species/forter/US-NY
Forster's Tern,"Dunkirk Harbor, Chautauqua, New York, United States",/species/forter/US-NY
Forster's Tern,"Randalls Island, New York, New York, United States",/species/forter/US-NY
Common Tern,"Cedar state boat channel, Suffolk, New York, United States",/species/comter/US-NY
Common Tern,"Seatuck Marsh, Suffolk, New York, United States",/species/comter/US-NY
Common Tern,"Upper Lisle County Park, Broome, New York, United States",/species/comter/US-NY
Roseate Tern,"Great Gull Island, Suffolk, New York, United States",/species/roster/US-NY
Roseate Tern,"Great Gull Island, Suffolk, New York, United States",/species/roster/US-NY
Roseate Tern,"Great Gull Island, Suffolk, New York, United States",/species/roster/US-NY
Red-throated Loon,"Lisle Park & Keibel Rd., Broome, New York, United States",/species/retloo/US-NY
Red-throated Loon,"Lisle Park & Keibel Rd., Broome, New York, United States",/species/retloo/US-NY
Red-throated Loon,"Onondaga Lake Park--Liverpool Marina, Onondaga, New York, United States",/species/retloo/US-NY
Anhinga,"Green-Wood Cemetery, Brooklyn, Kings, New York, United States",/species/anhing/US-NY
Great Cormorant,"Global south terminal piling, Orange, New York, United States",/species/grecor/US-NY
Great Cormorant,"Global south terminal piling, Orange, New York, United States",/species/grecor/US-NY
Neotropic Cormorant,"Allan H. Treman State Marine Park--marina (not lakeshore or woods), Tompkins, New York, United States",/species/neocor/US-NY
Neotropic Cormorant,"Allan Treman Marina, Ithaca US-NY 42.45794, -76.51248, Tompkins, New York, United States",/species/neocor/US-NY
Neotropic Cormorant,"Lighthouse Point Natural Area (Jetty Woods), Tompkins, New York, United States",/species/neocor/US-NY
Neotropic Cormorant,"NY:TOM:Ithaca: Allan H Treman State Marine Park: S/marina mouth, Tompkins, New York, United States",/species/neocor/US-NY
Glossy Ibis,"Central Park, New York, New York, United States",/species/gloibi/US-NY
American Bittern,"Great Kills Park--Mudflats, Richmond, New York, United States",/species/amebit/US-NY
American Bittern,"McGolrick Park, Kings, New York, United States",/species/amebit/US-NY
American Bittern,"Prospect Park, Kings, New York, United States",/species/amebit/US-NY
American Bittern,"Prospect Park, Kings, New York, United States",/species/amebit/US-NY
Least Bittern,"Braddock Bay--Buttonwood Creek, Monroe, New York, United States",/species/leabit/US-NY
Least Bittern,"Prospect Park, Kings, New York, United States",/species/leabit/US-NY
Least Bittern,"Prospect Park, Kings, New York, United States",/species/leabit/US-NY
Yellow-crowned Night Heron,"Starr Hill, Oneida, New York, United States",/species/ycnher/US-NY
Little Blue Heron,"Stillwater School Nature Trail, Saratoga, New York, United States",/species/libher/US-NY
Green Heron,"Allegany SP--Red House Maintenance Area, S Mtn Rd., Cattaraugus, New York, United States",/species/grnher/US-NY
Green Heron,"Hemlock Lake Park, Livingston, New York, United States",/species/grnher/US-NY
Great Egret,"Upper Lisle County Park, Broome, New York, United States",/species/greegr/US-NY
Great Egret,"Upper Lisle County Park, Broome, New York, United States",/species/greegr/US-NY
Great Egret,"Upper Lisle County Park, Broome, New York, United States",/species/greegr/US-NY
American White Pelican,"Montezuma NWR--Main Pool, Seneca, New York, United States",/species/amwpel/US-NY
American White Pelican,"Montezuma NWR--Wildlife Drive, Seneca, New York, United States",/species/amwpel/US-NY
American White Pelican,"Montezuma NWR--Wildlife Drive, Seneca, New York, United States",/species/amwpel/US-NY
American White Pelican,"Montezuma NWR--Wildlife Drive, Seneca, New York, United States",/species/amwpel/US-NY
Black Vulture,"Floyd Bennett Field--Community Gardens, Kings, New York, United States",/species/blkvul/US-NY
Black Vulture,"Floyd Bennett Field--Ecology Village Area, Kings, New York, United States",/species/blkvul/US-NY
Black Vulture,"Inwood Hill Park, New York, New York, United States",/species/blkvul/US-NY
Black Vulture,"Lincoln Terrace Park/Arthur S. Somers Park, Kings, New York, United States",/species/blkvul/US-NY
Swallow-tailed Kite,"Dresden, NY, Yates, New York, United States",/species/swtkit/US-NY
Swallow-tailed Kite,"Jones Beach SP--Coast Guard Station, Nassau, New York, United States",/species/swtkit/US-NY
Sharp-shinned Hawk,"Forest Park, Queens, New York, United States",/species/shshaw/US-NY
Sharp-shinned Hawk,"Frank Melville Memorial Park and Mill Pond, Suffolk, New York, United States",/species/shshaw/US-NY
Sharp-shinned Hawk,"Prospect Park, Kings, New York, United States",/species/shshaw/US-NY
Sharp-shinned Hawk,"Prospect Park, Kings, New York, United States",/species/shshaw/US-NY
Mississippi Kite,"West Point Foundry Preserve, Putnam, New York, United States",/species/miskit/US-NY
Broad-winged Hawk,"Central Park, New York, New York, United States",/species/brwhaw/US-NY
Broad-winged Hawk,"Central Park, New York, New York, United States",/species/brwhaw/US-NY
Broad-winged Hawk,"Central Park--The Ravine (incl. The Loch), New York, New York, United States",/species/brwhaw/US-NY
Broad-winged Hawk,"Fort Tryon Park, New York, New York, United States",/species/brwhaw/US-NY
Red-shouldered Hawk,"Brookhaven National Laboratory (restricted access), Suffolk, New York, United States",/species/reshaw/US-NY
Red-shouldered Hawk,"Central Park--The Ramble, New York, New York, United States",/species/reshaw/US-NY
Red-shouldered Hawk,"Private location, Mattituck, Suffolk, New York, United States",/species/reshaw/US-NY
Red-tailed Hawk (abieticola),"Montezuma-Private residence, Cayuga, New York, United States",/species/rethaw/US-NY
Eastern Screech-Owl,"Inwood Hill Park, New York, New York, United States",/species/easowl1/US-NY
Eastern Screech-Owl,"Inwood Hill Park, New York, New York, United States",/species/easowl1/US-NY
Eastern Screech-Owl,"Inwood Hill Park, New York, New York, United States",/species/easowl1/US-NY
Eastern Screech-Owl (Northern),"Inwood Hill Park, New York, New York, United States",/species/easowl1/US-NY
Eastern Screech-Owl,"Inwood Hill Park--Shorakkopoch Rock, New York, New York, United States",/species/easowl1/US-NY
Yellow-bellied Sapsucker,"Central Park, New York, New York, United States",/species/yebsap/US-NY
Yellow-bellied Sapsucker,"Central Park--Locust Grove, New York, New York, United States",/species/yebsap/US-NY
Yellow-bellied Sapsucker,"Hudson River Park--Tribeca Upland (Chambers to W Houston St.), New York, New York, United States",/species/yebsap/US-NY
Red-headed Woodpecker,"6340 Lagrange Rd, Wyoming US-NY 42.80055, -78.06315, Wyoming, New York, United States",/species/rehwoo/US-NY
Red-headed Woodpecker,"6415 Lagrange Rd, Wyoming US-NY 42.80121, -78.05732, Wyoming, New York, United States",/species/rehwoo/US-NY
Red-headed Woodpecker,"Fort Tryon Park, New York, New York, United States",/species/rehwoo/US-NY
Red-headed Woodpecker,"Schulenberg home, Tompkins, New York, United States",/species/rehwoo/US-NY
Pileated Woodpecker,"Forest Park, Queens, New York, United States",/species/pilwoo/US-NY
Pileated Woodpecker,"Riverside Park--Grant's Tomb + inside Riverside Dr., N to St. Clair Pl., New York, New York, United States",/species/pilwoo/US-NY
Pileated Woodpecker,"Riverside Park--North of 96th St., New York, New York, United States",/species/pilwoo/US-NY
