name,location,link_url
Pileated Woodpecker,"Riverside Park--North of 96th St., New York, New York, United States",/species/pilwoo/US-NY
Eastern Wood-Pewee,"Albany Rural Cemetery, Albany, New York, United States",/species/eawpew/US-NY
Eastern Wood-Pewee,"Inwood Hill Park, New York, New York, United States",/species/eawpew/US-NY
Eastern Wood-Pewee,"Inwood Hill Park, New York, New York, United States",/species/eawpew/US-NY
Willow Flycatcher,"Central Park--North End (N of 97th St. Transverse), New York, New York, United States",/species/wilfly/US-NY
Willow Flycatcher,"Central Park--North End (N of 97th St. Transverse), New York, New York, United States",/species/wilfly/US-NY
Least Flycatcher,"Hanging Bog WMA--Briggs Road wetland, Allegany, New York, United States",/species/leafly/US-NY
Least Flycatcher,"Hanging Bog WMA--Briggs Road wetland, Allegany, New York, United States",/species/leafly/US-NY
Least Flycatcher,"Hanging Bog WMA--Briggs Road wetland, Allegany, New York, United States",/species/leafly/US-NY
Least Flycatcher,"Hanging Bog WMA--Briggs Road wetland, Allegany, New York, United States",/species/leafly/US-NY
Great Crested Flycatcher,"Cheesecote Mountain Town Park, Rockland, New York, United States",/species/grcfly/US-NY
Great Crested Flycatcher,"Cheesecote Mountain Town Park, Rockland, New York, United States",/species/grcfly/US-NY
Great Crested Flycatcher,"Spackenkill, Dutchess, New York, United States",/species/grcfly/US-NY
Great Crested Flycatcher,"Ulster Park, Ulster, New York, United States",/species/grcfly/US-NY
Eastern Kingbird,"Lake Road Bluff, Aurora, Cayuga, New York, United States",/species/easkin/US-NY
Eastern Kingbird,"Owasco Lake inlet area, Cayuga, New York, United States",/species/easkin/US-NY
Eastern Kingbird,"Owasco Lake inlet area, Cayuga, New York, United States",/species/easkin/US-NY
White-eyed Vireo,"Forest Lawn Cemetery, Buffalo, Erie, New York, United States",/species/whevir/US-NY
White-eyed Vireo,"Forest Lawn Cemetery, Buffalo, Erie, New York, United States",/species/whevir/US-NY
White-eyed Vireo,"Forest Lawn Cemetery, Buffalo--Mirror Lake, Erie, New York, United States",/species/whevir/US-NY
White-eyed Vireo,"Reinstein Woods Nature Preserve, Erie, New York, United States",/species/whevir/US-NY
Yellow-throated Vireo,"North Spencer Marsh, Michigan Hollow Lake (restricted access), Tioga, New York, United States",/species/yetvir/US-NY
Yellow-throated Vireo,"North Spencer Marsh, Michigan Hollow Lake (restricted access), Tioga, New York, United States",/species/yetvir/US-NY
Yellow-throated Vireo,"Tonawanda WMA--Bartel Rd.-Owen Rd., Niagara, New York, United States",/species/yetvir/US-NY
Warbling Vireo (Eastern),"Armitage Road, forested area (Wayne Co.), Wayne, New York, United States",/species/warvir/US-NY
Warbling Vireo (Eastern),"Armitage Road, forested area (Wayne Co.), Wayne, New York, United States",/species/warvir/US-NY
Warbling Vireo (Eastern),"Armitage Road, forested area (Wayne Co.), Wayne, New York, United States",/species/warvir/US-NY
Warbling Vireo,"FOD, Allegany, New York, United States",/species/warvir/US-NY
Warbling Vireo,"Field of Dreams, Houghton, NY, Allegany, New York, United States",/species/warvir/US-NY
Warbling Vireo,"Houghton - Field of Dreams, Allegany, New York, United States",/species/warvir/US-NY
Warbling Vireo (Eastern),"Owasco Lake inlet area, Cayuga, New York, United States",/species/warvir/US-NY
Warbling Vireo,"WAG Trail, Island Park, Wellsville .NY, Allegany, New York, United States",/species/warvir/US-NY
Red-eyed Vireo,"98 Upper Byrdcliffe Way, Woodstock US-NY 42.05788, -74.13216, Ulster, New York, United States",/species/reevir1/US-NY
Red-eyed Vireo,"Bashakill State WMA--Horseshoe pull-off, Sullivan, New York, United States",/species/reevir1/US-NY
Red-eyed Vireo,"Black Rock Forest--Bog Meadow, Orange, New York, United States",/species/reevir1/US-NY
Red-eyed Vireo,"Mountainview, Rockland, New York, United States",/species/reevir1/US-NY
Fish Crow,"Fisk Flyway, Oswego, New York, United States",/species/fiscro/US-NY
Fish Crow,"Home area, Oswego, New York, United States",/species/fiscro/US-NY
Fish Crow,"Oswego- Miller Patch, Oswego, New York, United States",/species/fiscro/US-NY
Fish Crow,"Phoenix Dam and Lock, Oswego, New York, United States",/species/fiscro/US-NY
Bank Swallow,"Governors Island (N.Y. County), New York, New York, United States",/species/banswa/US-NY
Purple Martin,"Jamaica Bay Wildlife Refuge, Queens, New York, United States",/species/purmar/US-NY
Purple Martin,"Jamaica Bay Wildlife Refuge--West Pond, Queens, New York, United States",/species/purmar/US-NY
Purple Martin,"Jamaica Bay Wildlife Refuge--West Pond, Queens, New York, United States",/species/purmar/US-NY
Cliff Swallow,"Lily Pond, East Hampton, Suffolk, New York, United States",/species/cliswa/US-NY
Cliff Swallow,"Pelham Bay Park--Southern Meadow and environs, Bronx, New York, United States",/species/cliswa/US-NY
Golden-crowned Kinglet,"Prospect Park, Kings, New York, United States",/species/gockin/US-NY
Sedge Wren,"YARD 43.2826553, -76.8022361, Wayne, New York, United States",/species/sedwre1/US-NY
Marsh Wren,"1344 County Road 85, Addison, New York, US (42.053, -77.273), Steuben, New York, United States",/species/marwre/US-NY
Marsh Wren,"Central Park--The Ravine (incl. The Loch), New York, New York, United States",/species/marwre/US-NY
Marsh Wren,"Central Park--The Ravine (incl. The Loch), New York, New York, United States",/species/marwre/US-NY
Marsh Wren,"Sherburne 4 Corners ag fields & pond, Chenango, New York, United States",/species/marwre/US-NY
Gray Catbird,"Beechwood SP, Sodus, Wayne, New York, United States",/species/grycat/US-NY
Gray Catbird,"Beechwood SP, Sodus, Wayne, New York, United States",/species/grycat/US-NY
Gray Catbird,"Home, Monroe, New York, United States",/species/grycat/US-NY
Gray Catbird,"Home (backyard), Cattaraugus, New York, United States",/species/grycat/US-NY
Northern Mockingbird,"Auto selected 43.82338, -73.43399, Essex, New York, United States",/species/normoc/US-NY
Northern Mockingbird,"Dennison Road, St. Lawrence, New York, United States",/species/normoc/US-NY
Northern Mockingbird,"Paul Smith's College, Franklin, New York, United States",/species/normoc/US-NY
Northern Mockingbird,"Paul Smith's College, Franklin, New York, United States",/species/normoc/US-NY
Mountain Bluebird,"15 Willow Road, Old Bethpage, New York, US (40.773, -73.447), Nassau, New York, United States",/species/moublu/US-NY
Townsend's Solitaire,"Verona Beach SP, Oneida, New York, United States",/species/towsol/US-NY
Townsend's Solitaire,"Verona Beach SP, Oneida, New York, United States",/species/towsol/US-NY
Townsend's Solitaire,"Verona Beach SP, Oneida, New York, United States",/species/towsol/US-NY
Townsend's Solitaire,"Verona Beach SP, Oneida, New York, United States",/species/towsol/US-NY
Veery,"Jennings Pond, Danby, Tompkins, New York, United States",/species/veery/US-NY
Veery,"Monkey Run--South, Tompkins, New York, United States",/species/veery/US-NY
Veery,"Monkey Run--West (Ithaca East NW Atlas block), Tompkins, New York, United States",/species/veery/US-NY
Veery,"Steam Mill Rd., Danby, Tompkins, New York, United States",/species/veery/US-NY
Swainson's Thrush,"Central Park, New York, New York, United States",/species/swathr/US-NY
Swainson's Thrush (Olive-backed),"Central Park, New York, New York, United States",/species/swathr/US-NY
Swainson's Thrush,"Central Park--The Ramble, New York, New York, United States",/species/swathr/US-NY
Swainson's Thrush,"Clarence Fahnestock SP--School Mtn. Road Trail and Wetlands, Putnam, New York, United States",/species/swathr/US-NY
Wood Thrush,"Montezuma (NMWMA)--Railroad Rd. Marshes, Wayne, New York, United States",/species/woothr/US-NY
Wood Thrush,"Oatka Creek Park Scottsville, New York, US (43.006, -77.793), Monroe, New York, United States",/species/woothr/US-NY
Wood Thrush,"Oatka Creek Park Scottsville, New York, US (43.006, -77.793), Monroe, New York, United States",/species/woothr/US-NY
Evening Grosbeak,"Babcock Lake, Grafton, NY, Rensselaer, New York, United States",/species/evegro/US-NY
Evening Grosbeak,"Bath, NY, Steuben, New York, United States",/species/evegro/US-NY
Evening Grosbeak,"Padanarum Road, Warren, New York, United States",/species/evegro/US-NY
Purple Finch,"Central Park, New York US-NY 40.77747, -73.96840, New York, New York, United States",/species/purfin/US-NY
Purple Finch,"Central Park--North End (N of 97th St. Transverse), New York, New York, United States",/species/purfin/US-NY
Purple Finch,"Central Park--The Ramble, New York, New York, United States",/species/purfin/US-NY
Purple Finch,"Central Park--The Ramble, New York, New York, United States",/species/purfin/US-NY
Red Crossbill,"43 Montauk Highway, Center Moriches, New York, US (40.799, -72.775), Suffolk, New York, United States",/species/redcro/US-NY
Red Crossbill,"Cline Rd., marsh (east), Fulton, New York, United States",/species/redcro/US-NY
Red Crossbill (Western Hemlock or type 3),"Sheep Meadow Trail, Franklin, New York, United States",/species/redcro/US-NY
Red Crossbill,"Verona Beach SP, Oneida, New York, United States",/species/redcro/US-NY
European Goldfinch,"Cross Island Pkwy & Hillside ave, Queens, New York, United States",/species/eurgol/US-NY
European Goldfinch,"Cross Island Pkwy & Hillside ave, Queens, New York, United States",/species/eurgol/US-NY
European Goldfinch,"Ridgewood Reservoir, Queens, New York, United States",/species/eurgol/US-NY
Pine Siskin,"Dock St, Yonkers US-NY 40.93594, -73.90262, Westchester, New York, United States",/species/pinsis/US-NY
Pine Siskin (green morph),"Mezzio Road, Forestville, Chautauqua, New York, United States",/species/pinsis/US-NY
Snow Bunting,"El Dorado Beach Preserve, Jefferson, New York, United States",/species/snobun/US-NY
Grasshopper Sparrow,"EPCAL, NY, Suffolk, New York, United States",/species/graspa/US-NY
Clay-colored Sparrow,"Krull County Park, Niagara, New York, United States",/species/clcspa/US-NY
Clay-colored Sparrow,"Madison St, Ithaca US-NY (42.4463,-76.5029), Tompkins, New York, United States",/species/clcspa/US-NY
Clay-colored Sparrow,"Merrit Rd. Tree Farm, Oswego, New York, United States",/species/clcspa/US-NY
American Tree Sparrow,"Montezuma NWR--Wildlife Drive, Seneca, New York, United States",/species/amtspa/US-NY
American Tree Sparrow,"Ontario Home Patch, Wayne, New York, United States",/species/amtspa/US-NY
American Tree Sparrow,"Reinstein Woods Nature Preserve, Erie, New York, United States",/species/amtspa/US-NY
Fox Sparrow,"Beaver Lake Nature Center, Onondaga, New York, United States",/species/foxspa/US-NY
Fox Sparrow (Red),"Great Flats Nature Preserve, Schenectady, New York, United States",/species/foxspa/US-NY
Fox Sparrow,"Le Moyne College--Woods, Onondaga, New York, United States",/species/foxspa/US-NY
Fox Sparrow,"Long Branch Park, Onondaga, New York, United States",/species/foxspa/US-NY
Fox Sparrow,"Murphy's Island, Onondaga Lake, Onondaga, New York, United States",/species/foxspa/US-NY
Dark-eyed Junco (Slate-colored),"28th Street, Astoria, Queens, New York, United States",/species/daejun/US-NY
White-crowned Sparrow,"Central Park, New York, New York, United States",/species/whcspa/US-NY
White-crowned Sparrow (leucophrys),"Central Park, New York, New York, United States",/species/whcspa/US-NY
White-crowned Sparrow (leucophrys),"Central Park, New York, New York, United States",/species/whcspa/US-NY
White-crowned Sparrow,"Central Park, New York US-NY 40.77686, -73.96913, New York, New York, United States",/species/whcspa/US-NY
White-crowned Sparrow,"Central Park--Evodia Field, New York, New York, United States",/species/whcspa/US-NY
White-crowned Sparrow,"Corlears Hook Park, New York, New York, United States",/species/whcspa/US-NY
Dark-eyed Junco x White-throated Sparrow (hybrid),"Central Park--The Ramble, New York, New York, United States",/species/x00039/US-NY
Lincoln's Sparrow,"Central Park--North End (N of 97th St. Transverse), New York, New York, United States",/species/linspa/US-NY
Lincoln's Sparrow,"Central Park--The Pool, New York, New York, United States",/species/linspa/US-NY
Lincoln's Sparrow,"South Oxford Park, Brooklyn, Kings, New York, United States",/species/linspa/US-NY
Eastern Towhee (Red-eyed),"Oneida Lake--Lakeshore, Oneida, New York, United States",/species/eastow/US-NY
Yellow-breasted Chat,"Central Park--Maintenance Meadow, New York, New York, United States",/species/yebcha/US-NY
Yellow-breasted Chat,"Central Park--The Ramble, New York, New York, United States",/species/yebcha/US-NY
Yellow-breasted Chat,"Central Park--The Ramble, New York, New York, United States",/species/yebcha/US-NY
Bobolink,"Piermont Pier, Rockland, New York, United States",/species/boboli/US-NY
Bobolink,"Purinton Road, Saratoga, New York, United States",/species/boboli/US-NY
Bobolink,"Stony Kill Farm EEC, Dutchess, New York, United States",/species/boboli/US-NY
Bobolink,"Stony Kill Farm EEC, Dutchess, New York, United States",/species/boboli/US-NY
Eastern Meadowlark,"Central Park, New York, New York, United States",/species/easmea/US-NY
Orchard Oriole,"2700 Centerline Road, Varysburg, Wyoming, New York, United States",/species/orcori/US-NY
Orchard Oriole,"7950 U.S. 62, South Dayton, New York, US (42.344, -79.005), Cattaraugus, New York, United States",/species/orcori/US-NY
Orchard Oriole,"Birdfeeders 2613 Lyndonville Road, Medina, New York, US (43.288, -78.389), Orleans, New York, United States",/species/orcori/US-NY
Baltimore Oriole,"LeHigh Valley Trail-Gracie to Lime Hollow, Cortland, New York, United States",/species/balori/US-NY
Baltimore Oriole,"LeHigh Valley Trail-Gracie to Lime Hollow, Cortland, New York, United States",/species/balori/US-NY
Baltimore Oriole,"Scott home, Cortland, New York, United States",/species/balori/US-NY
Baltimore Oriole,"Tuller Hill SF—Pipeline Rd (eastern), Cortland, New York, United States",/species/balori/US-NY
Ovenbird,"207 Stoller Hill Rd, Otsego, New York, United States",/species/ovenbi1/US-NY
Ovenbird,"Goey Pond Rd, Otsego, New York, United States",/species/ovenbi1/US-NY
Ovenbird,"Hemlock Hollow Trail, Salamanca, New York, US (42.103, -78.764), Cattaraugus, New York, United States",/species/ovenbi1/US-NY
Ovenbird,"North Country National Scenic Trail, Salamanca US-NY 42.04403, -78.76588, Cattaraugus, New York, United States",/species/ovenbi1/US-NY
Worm-eating Warbler,"Mohonk Preserve--Undercliff Carriage Road, Ulster, New York, United States",/species/woewar1/US-NY
Worm-eating Warbler,"West Clove Mountain Road, Dutchess, New York, United States",/species/woewar1/US-NY
Worm-eating Warbler,"West Clove Mountain Road, Dutchess, New York, United States",/species/woewar1/US-NY
Louisiana Waterthrush,"Putts Creek (below the new bridge), Essex, New York, United States",/species/louwat/US-NY
Louisiana Waterthrush,"Putts Creek (stair falls), Essex, New York, United States",/species/louwat/US-NY
Louisiana Waterthrush,"Putts Creek (trout fishing bridge), Essex, New York, United States",/species/louwat/US-NY
Northern Waterthrush,"Beaver Meadow Audubon Center, Wyoming, New York, United States",/species/norwat/US-NY
Northern Waterthrush,"Beaver Meadow Audubon Center, Wyoming, New York, United States",/species/norwat/US-NY
Northern Waterthrush,"Beaver Meadow Audubon Center, Wyoming, New York, United States",/species/norwat/US-NY
Golden-winged Warbler,"Home, Oswego, New York, United States",/species/gowwar/US-NY
Golden-winged Warbler,"Home - Mapleton Rd., Niagara, New York, United States",/species/gowwar/US-NY
Golden-winged Warbler,"Newland Park Jamestown, Chautauqua, New York, United States",/species/gowwar/US-NY
Golden-winged Warbler,"Sheldrake Lake (Larchmont Reservoir), Westchester, New York, United States",/species/gowwar/US-NY
Blue-winged Warbler,"Allegany SP--Camp Allegany, Cattaraugus, New York, United States",/species/buwwar/US-NY
Blue-winged Warbler,"Allegany SP--Camp Allegany, Cattaraugus, New York, United States",/species/buwwar/US-NY
Blue-winged Warbler,"LeHigh Valley Trail-Gracie to Lime Hollow, Cortland, New York, United States",/species/buwwar/US-NY
Blue-winged Warbler,"Pat McGee Trail, 9759 Leon Road, Cattaraugus, New York, US, Cattaraugus, New York, United States",/species/buwwar/US-NY
Lawrence's Warbler (hybrid),"Cayuga Inlet PFA--Brown Rd (42.338, -76.53), Tompkins, New York, United States",/species/lawwar/US-NY
Lawrence's Warbler (hybrid),"Peach Hill Park, Dutchess, New York, United States",/species/lawwar/US-NY
Lawrence's Warbler (hybrid),"Rockefeller SP Preserve, Westchester, New York, United States",/species/lawwar/US-NY
Black-and-white Warbler,"Hanging Bog WMA--Briggs Road wetland, Allegany, New York, United States",/species/bawwar/US-NY
Black-and-white Warbler,"Hanging Bog WMA--Briggs Road wetland, Allegany, New York, United States",/species/bawwar/US-NY
Black-and-white Warbler,"WAG trail, north of Graves Rd, Allegany, New York, United States",/species/bawwar/US-NY
Prothonotary Warbler,"Central Park--The Lake (Hernshead), New York, New York, United States",/species/prowar/US-NY
Prothonotary Warbler,"Lily pond, Suffolk, New York, United States",/species/prowar/US-NY
Prothonotary Warbler,"The Pool in Central Park, New York, New York, United States",/species/prowar/US-NY
Tennessee Warbler,"Bear Mountain SP--Jones Point Path, Rockland, New York, United States",/species/tenwar/US-NY
Tennessee Warbler,"Bear Mountain SP--Jones Point Path, Rockland, New York, United States",/species/tenwar/US-NY
Tennessee Warbler,"Rockland Lake SP--Nature Center + environs, Rockland, New York, United States",/species/tenwar/US-NY
Orange-crowned Warbler,"Brooklyn Botanic Garden, Kings, New York, United States",/species/orcwar/US-NY
Orange-crowned Warbler,"Prospect Park, Kings, New York, United States",/species/orcwar/US-NY
Orange-crowned Warbler,"Prospect Park, Kings, New York, United States",/species/orcwar/US-NY
Orange-crowned Warbler,"Prospect Park, Kings, New York, United States",/species/orcwar/US-NY
Nashville Warbler,"605–627 Chlorinator Rd, Milford US-NY 42.59847, -74.96803, Otsego, New York, United States",/species/naswar/US-NY
Nashville Warbler,"Hemlock Hollow Trail, Salamanca, New York, US (42.103, -78.764), Cattaraugus, New York, United States",/species/naswar/US-NY
Nashville Warbler,"Pat McGee Trail, 9759 Leon Road, Cattaraugus, New York, US, Cattaraugus, New York, United States",/species/naswar/US-NY
Kentucky Warbler,"Central Park--The Lake (Hernshead), New York, New York, United States",/species/kenwar/US-NY
Kentucky Warbler,"Central Park--The Lake (Hernshead), New York, New York, United States",/species/kenwar/US-NY
Kentucky Warbler,"Central Park--The Lake (Hernshead), New York, New York, United States",/species/kenwar/US-NY
Kentucky Warbler,"Central Park--The Lake (Hernshead), New York, New York, United States",/species/kenwar/US-NY
Common Yellowthroat,"Allegany SP--Camp Allegany, Cattaraugus, New York, United States",/species/comyel/US-NY
Common Yellowthroat,"Allegany SP--Camp Allegany, Cattaraugus, New York, United States",/species/comyel/US-NY
Common Yellowthroat,"Golden Hill SP, Niagara, New York, United States",/species/comyel/US-NY
Common Yellowthroat,"Golden Hill SP, Niagara, New York, United States",/species/comyel/US-NY
Hooded Warbler,"13493, Williamstown US-NY 43.41860, -75.96829, Oswego, New York, United States",/species/hoowar/US-NY
Hooded Warbler,"Deer Creek Marsh WMA--Lake Trail, Oswego, New York, United States",/species/hoowar/US-NY
Hooded Warbler,"Meadows Rd, Arkwright, NY, Chautauqua, New York, United States",/species/hoowar/US-NY
American Redstart,"Genesee Valley Greenway, Houghton, Allegany, New York, United States",/species/amered/US-NY
American Redstart,"Genesee Valley Greenway, Houghton, Allegany, New York, United States",/species/amered/US-NY
American Redstart,"Genesee Valley Greenway, Houghton, Allegany, New York, United States",/species/amered/US-NY
American Redstart,"Genesee Valley Greenway, Houghton, Allegany, New York, United States",/species/amered/US-NY
Cape May Warbler,"Broome COUNTY, Broome, New York, United States",/species/camwar/US-NY
Cape May Warbler,"Normanskill Farm, Albany, New York, United States",/species/camwar/US-NY
Cape May Warbler,"Upper Lisle County Park--Basset Rd., Broome, New York, United States",/species/camwar/US-NY
Cape May Warbler,"Wilson-Tuscarora State Park, Wilson US-NY (43.3106,-78.8507), Niagara, New York, United States",/species/camwar/US-NY
Cerulean Warbler,"Bashakill State WMA, Sullivan, New York, United States",/species/cerwar/US-NY
Cerulean Warbler,"Bashakill State WMA, Sullivan, New York, United States",/species/cerwar/US-NY
Cerulean Warbler,"Bashakill State WMA, Sullivan, New York, United States",/species/cerwar/US-NY
Cerulean Warbler,"Bear Mountain SP--Doodletown Rd., Rockland, New York, United States",/species/cerwar/US-NY
Northern Parula,"Camp Stonehaven Nature Preserve, Niagara, New York, United States",/species/norpar/US-NY
Northern Parula,"Letchworth SP--Visitor Center, Wyoming, New York, United States",/species/norpar/US-NY
Northern Parula,"Pat McGee Trail, 9759 Leon Road, Cattaraugus, New York, US, Cattaraugus, New York, United States",/species/norpar/US-NY
Northern Parula,"Spring Farm Nature Sanctuary, Oneida, New York, United States",/species/norpar/US-NY
Magnolia Warbler,"Broome COUNTY, Broome, New York, United States",/species/magwar/US-NY
Magnolia Warbler,"Upper Lisle County Park, Broome, New York, United States",/species/magwar/US-NY
Magnolia Warbler,"Upper Lisle County Park--Basset Rd., Broome, New York, United States",/species/magwar/US-NY
Bay-breasted Warbler,"Central Park--The Ramble, New York, New York, United States",/species/babwar/US-NY
Blackburnian Warbler,"Heiberg Memorial Forest--Foley Rd., Cortland, New York, United States",/species/bkbwar/US-NY
Blackburnian Warbler,"Home, Niagara, New York, United States",/species/bkbwar/US-NY
Blackburnian Warbler,"Letchworth SP--Visitor Center, Wyoming, New York, United States",/species/bkbwar/US-NY
Blackburnian Warbler,"Lime Hollow--Osbeck Conservation Area, Cortland, New York, United States",/species/bkbwar/US-NY
Yellow Warbler,"14591, Wyoming US-NY 42.82020, -78.08958, Wyoming, New York, United States",/species/yelwar/US-NY
Yellow Warbler,"Allegany SP--Camp Allegany, Cattaraugus, New York, United States",/species/yelwar/US-NY
Yellow Warbler,"Silver Lake (Wyoming Co.), south, Wyoming, New York, United States",/species/yelwar/US-NY
Chestnut-sided Warbler,"605–627 Chlorinator Rd, Milford US-NY 42.59847, -74.96803, Otsego, New York, United States",/species/chswar/US-NY
Chestnut-sided Warbler,"Lime Hollow--Osbeck Conservation Area, Cortland, New York, United States",/species/chswar/US-NY
Chestnut-sided Warbler,"Robert V. Riddell SP, Otsego, New York, United States",/species/chswar/US-NY
Blackpoll Warbler,"Central Park--The Ramble, New York, New York, United States",/species/bkpwar/US-NY
Blackpoll Warbler,"Central Park--The Ramble, New York, New York, United States",/species/bkpwar/US-NY
Blackpoll Warbler,"Central Park--Turtle Pond, New York, New York, United States",/species/bkpwar/US-NY
Blackpoll Warbler,"Inwood Hill Park, New York, New York, United States",/species/bkpwar/US-NY
Black-throated Blue Warbler,"Connecticut Hill WMA--Bob Cameron Loop, Tompkins, New York, United States",/species/btbwar/US-NY
Black-throated Blue Warbler,"Home, 205 The Heights, Little Valley, New York, US (42.245, -78.796), Cattaraugus, New York, United States",/species/btbwar/US-NY
Black-throated Blue Warbler,"North Country National Scenic Trail, Salamanca US-NY 42.04403, -78.76588, Cattaraugus, New York, United States",/species/btbwar/US-NY
Black-throated Blue Warbler,"Tuller Hill SF—Pipeline Rd (eastern), Cortland, New York, United States",/species/btbwar/US-NY
Yellow-throated Warbler,"Bayard Cutting Arboretum SP, Suffolk, New York, United States",/species/yetwar/US-NY
Yellow-throated Warbler,"Central Park, New York, New York, United States",/species/yetwar/US-NY
Yellow-throated Warbler,"Central Park--The Ravine (incl. The Loch), New York, New York, United States",/species/yetwar/US-NY
Prairie Warbler,"Firehouse Woods & Goodwin Park, Monroe, New York, United States",/species/prawar/US-NY
Prairie Warbler,"Firehouse Woods & Goodwin Park, Monroe, New York, United States",/species/prawar/US-NY
Prairie Warbler,"Firehouse Woods & Goodwin Park, Monroe, New York, United States",/species/prawar/US-NY
Canada Warbler,"Slide Mountain, Ulster, New York, United States",/species/canwar/US-NY
Wilson's Warbler,"Central Park, New York US-NY 40.77517, -73.96844, New York, New York, United States",/species/wlswar/US-NY
Wilson's Warbler,"Central Park--The Ramble, New York, New York, United States",/species/wlswar/US-NY
Wilson's Warbler,"Clove Lakes Park, Richmond, New York, United States",/species/wlswar/US-NY
Summer Tanager,"Bayard Cutting Arboretum SP, Suffolk, New York, United States",/species/sumtan/US-NY
Summer Tanager,"Bayard Cutting Arboretum SP, Suffolk, New York, United States",/species/sumtan/US-NY
Summer Tanager,"Bayard Cutting Arboretum SP, Suffolk, New York, United States",/species/sumtan/US-NY
Scarlet Tanager,"4101 CR-56, Johnson lower Glenn City US-NY 42.12553, -75.99766, Broome, New York, United States",/species/scatan/US-NY
Scarlet Tanager,"Hemlock Hollow Trail, Salamanca, New York, US (42.103, -78.764), Cattaraugus, New York, United States",/species/scatan/US-NY
Scarlet Tanager,"Home, Oswego, New York, United States",/species/scatan/US-NY
Scarlet Tanager,"Lower Glen, 4101 Watson Boulevard, Johnson City, New York, US (42.124, -75.997), Broome, New York, United States",/species/scatan/US-NY
Rose-breasted Grosbeak,"25 Brookside Ln, Chenango Forks US-NY 42.23605, -75.79840, Broome, New York, United States",/species/robgro/US-NY
Rose-breasted Grosbeak,"410 Caldwell Hill Rd, Lisle US-NY 42.29598, -76.07553, Broome, New York, United States",/species/robgro/US-NY
