name,location,link_url
Rose-breasted Grosbeak,"S. Granby Rd wetland at Ox Creek, Oswego, New York, United States",/species/robgro/US-NY
Rose-breasted Grosbeak,"State Rd. Nature Preserve, Monroe, New York, United States",/species/robgro/US-NY
Indigo Bunting,"Home, Schuyler, New York, United States",/species/indbun/US-NY
Indigo Bunting,"Larkspur Farm house (private), Columbia, New York, United States",/species/indbun/US-NY
Indigo Bunting,"Larkspur Farm house (private), Columbia, New York, United States",/species/indbun/US-NY
Indigo Bunting,"my yard/NE Rochester, Monroe, New York, United States",/species/indbun/US-NY
Painted Bunting,"310 First St, Ithaca US-NY (42.4466,-76.5030), Tompkins, New York, United States",/species/paibun/US-NY
Painted Bunting,"310 First St, Ithaca US-NY (42.4466,-76.5030), Tompkins, New York, United States",/species/paibun/US-NY
